user_id,text,output
"dk-crazydiv","हम आपके <mask> यात्रा की कामना करते हैं","सुखद"
"dk-crazydiv","मुझे उनसे बात करना बहुत <mask> लगा","अच्छा"
"dk-crazydiv","बार बार देखो, हज़ार बार देखो, ये देखने की <mask> है","चीज़"
"dk-crazydiv","ट्रंप कल अहमदाबाद में प्रधानमंत्री मोदी से <mask> करने जा रहे हैं","मुलाकात"
"dk-crazydiv","बॉम्बे से बैंगलोर की <mask> 500 किलोमीटर है","दूरी"
"dk-crazydiv","कहने को साथ अपने ये <mask> चलती है","दुनिया"
"dk-crazydiv","ये इश्क़ नहीं आसान बस इतना समझ लीजिये, एक आग का दरिया है और <mask> के जाना है","डूब"